{
  "schema_version": "0.1.0",
  "run_id": "run_opaque",
  "request_id": "req_opaque",
  "request_sha256": "5df6e0e2761359d30a8275058e299fcc0381534545f55cf43e41983f5d4c9456",
  "work_sha256": "9f86d081884c7d659a2feaa0c55ad015a3bf4f1b2b0b822cd15d6c15b0f00a08",
  "status": "succeeded",
  "terminal_phase": "terminal",
  "reason_code": "completed",
  "started_at": "2026-07-10T16:40:10.268Z",
  "ended_at": "2026-07-10T16:40:47.089Z",
  "workload_exit_code": 0,
  "placement": {
    "backend": "rooms",
    "profile": "agent-cursor",
    "allocation_id": "01kx6ed7rze1sba5fm5sqy3rvz",
    "image_sha256": "6b86b273ff34fce19d6b804eff5a3f5747ada4eaa22f1d49c01e52ddb7875b4b",
    "stream_delivery": "terminal_replay",
    "enforced": {
      "network": "egress",
      "cpu": 1,
      "memory_mib": 512
    },
    "details": {"slot": 2}
  },
  "causes": [],
  "diagnostics": [],
  "artifacts": [
    {
      "name": "result",
      "path": "artifacts/result.json",
      "sha256": "4e07408562bedb8b60ce05c1decfe3ad16b72230967de01f640b7e4729b49fce",
      "size": 412
    }
  ]
}
